{
  "schema_version": 1,
  "status": "valid",
  "failure_reason": null,
  "run": {
    "scenario": "steady-warm-v1",
    "run_number": 1,
    "cache_mode": "warm",
    "manifest_hash": "fixture-manifest-hash",
    "settings_hash": "fixture-requested-settings-hash",
    "warmup_seconds": 30,
    "duration_seconds": 120,
    "poll_interval_seconds": 0.5
  },
  "context": {
    "backend_label": "native-gl",
    "build_type": "Release",
    "cpu": "Fixture CPU",
    "detected_backend": "native-gl",
    "driver": "fixture-driver",
    "effective_settings": {"RenderVSyncEnable": false},
    "effective_settings_hash": "fixture-effective-settings-hash",
    "feature_flags": {"RenderVSyncEnable": false},
    "feature_flags_hash": "fixture-feature-flags-hash",
    "git_commit": "0000000000000000000000000000000000000000",
    "git_diff_hash": "e3b0c44298fc1c149afbf4c8996fb92427ae41e4649b934ca495991b7852b855",
    "git_dirty": false,
    "gpu": "Fixture GPU",
    "gpu_vendor": "Fixture Vendor",
    "gpu_vram_mb": 8192,
    "hardware_label": "fixture-current-gpu",
    "height": 720,
    "logical_core_count": 16,
    "opengl_profile": "core",
    "opengl_version": "4.6 fixture",
    "gl_extensions": ["GL_ARB_fixture"],
    "gl_extensions_hash": "fixture-extensions-hash",
    "gl_limits": {
      "max_samples": 8,
      "max_texture_image_units": 32,
      "max_texture_size": 16384,
      "max_uniform_block_size": 65536
    },
    "os": "Fixture OS",
    "viewer_channel": "Second Life Test",
    "viewer_version": "0.0.0.0",
    "shader_level": 3,
    "width": 1280
  },
  "instrumentation": {
    "mode": "steady-low-overhead",
    "compile_time_enabled": true,
    "cpu_phase_timing": true,
    "resource_counters": true,
    "gpu_pass_timing": "external-diagnostic",
    "gpu_query_readback_in_steady_loop": false
  },
  "frames": [
    {
      "frame_number": 100,
      "frame_time_ms": 10.0,
      "geometry_create_ms": 0.2,
      "partition_ms": 0.1,
      "geometry_update_ms": 0.3,
      "cull_ms": 0.4,
      "state_sort_ms": 0.5,
      "submission_ms": 2.0,
      "lighting_ms": 1.0,
      "ui_ms": 0.8,
      "swap_ms": 0.1,
      "idle_ms": 1.0,
      "unclassified_ms": 3.6,
      "draw_calls": 800,
      "batch_size_mean": 24.0,
      "ktriangles": 240.0,
      "texture_upload_count_total": 10,
      "texture_upload_bytes_total": 1000,
      "texture_readback_count_total": 0,
      "texture_readback_time_us_total": 0,
      "texture_wait_count_total": 1,
      "texture_wait_time_us_total": 20,
      "shader_compile_count_total": 200,
      "shader_compile_time_us_total": 500000,
      "shader_bind_count_total": 1000
    },
    {
      "frame_number": 101,
      "frame_time_ms": 12.0,
      "geometry_create_ms": 0.2,
      "partition_ms": 0.1,
      "geometry_update_ms": 0.4,
      "cull_ms": 0.5,
      "state_sort_ms": 0.6,
      "submission_ms": 2.4,
      "lighting_ms": 1.2,
      "ui_ms": 0.9,
      "swap_ms": 0.1,
      "idle_ms": 1.1,
      "unclassified_ms": 4.5,
      "draw_calls": 820,
      "batch_size_mean": 23.0,
      "ktriangles": 250.0,
      "texture_upload_count_total": 12,
      "texture_upload_bytes_total": 3048,
      "texture_readback_count_total": 0,
      "texture_readback_time_us_total": 0,
      "texture_wait_count_total": 1,
      "texture_wait_time_us_total": 20,
      "shader_compile_count_total": 200,
      "shader_compile_time_us_total": 500000,
      "shader_bind_count_total": 1080
    },
    {
      "frame_number": 102,
      "frame_time_ms": 11.0,
      "geometry_create_ms": 0.2,
      "partition_ms": 0.1,
      "geometry_update_ms": 0.3,
      "cull_ms": 0.4,
      "state_sort_ms": 0.5,
      "submission_ms": 2.1,
      "lighting_ms": 1.0,
      "ui_ms": 0.8,
      "swap_ms": 0.1,
      "idle_ms": 1.0,
      "unclassified_ms": 4.5,
      "draw_calls": 805,
      "batch_size_mean": 24.0,
      "ktriangles": 242.0,
      "texture_upload_count_total": 12,
      "texture_upload_bytes_total": 3048,
      "texture_readback_count_total": 0,
      "texture_readback_time_us_total": 0,
      "texture_wait_count_total": 2,
      "texture_wait_time_us_total": 50,
      "shader_compile_count_total": 200,
      "shader_compile_time_us_total": 500000,
      "shader_bind_count_total": 1160
    },
    {
      "frame_number": 103,
      "frame_time_ms": 30.0,
      "geometry_create_ms": 0.4,
      "partition_ms": 0.2,
      "geometry_update_ms": 0.8,
      "cull_ms": 0.9,
      "state_sort_ms": 1.0,
      "submission_ms": 8.0,
      "lighting_ms": 4.0,
      "ui_ms": 1.2,
      "swap_ms": 0.2,
      "idle_ms": 1.4,
      "unclassified_ms": 11.9,
      "draw_calls": 1200,
      "batch_size_mean": 18.0,
      "ktriangles": 400.0,
      "texture_upload_count_total": 14,
      "texture_upload_bytes_total": 7144,
      "texture_readback_count_total": 1,
      "texture_readback_time_us_total": 300,
      "texture_wait_count_total": 3,
      "texture_wait_time_us_total": 150,
      "shader_compile_count_total": 201,
      "shader_compile_time_us_total": 502000,
      "shader_bind_count_total": 1300
    }
  ],
  "summary": {
    "sample_count": 4,
    "frame_time_ms": {
      "median": 11.5,
      "p95": 27.299999999999994,
      "p99": 29.459999999999997,
      "worst": 30.0
    },
    "one_percent_low_fps": 33.333333333333336,
    "phase_p95_ms": {
      "cull_ms": 0.8399999999999999,
      "geometry_create_ms": 0.36999999999999994,
      "geometry_update_ms": 0.7399999999999999,
      "idle_ms": 1.355,
      "lighting_ms": 3.579999999999999,
      "partition_ms": 0.18499999999999997,
      "state_sort_ms": 0.9399999999999998,
      "submission_ms": 7.159999999999998,
      "swap_ms": 0.18499999999999997,
      "ui_ms": 1.1549999999999998
    },
    "counter_deltas": {
      "shader_bind_count": 300.0,
      "shader_compile_count": 1.0,
      "shader_compile_time_us": 2000.0,
      "texture_readback_count": 1.0,
      "texture_readback_time_us": 300.0,
      "texture_upload_bytes": 6144.0,
      "texture_upload_count": 4.0,
      "texture_wait_count": 2.0,
      "texture_wait_time_us": 130.0
    }
  }
}
